meas. num.,passed,YES votes,NO votes,% YES,Const. Amd.?,type,description
2.0,No,376489.0,536967.0,41.22%,Yes,LEG,"Allows changing city, county election days"
3.0,No,285777.0,679517.0,29.61%,Yes,LEG,Lowers minimum age for legislative service
4.0,YES,507308.0,368646.0,57.91%,Yes,LEG,Repeals emergency succession provision
5.0,YES,549126.0,377354.0,59.27%,Yes,LEG,Permits legislature to call special session
7.0,No,263738.0,659327.0,28.57%,No,LEG,Partial public funding of election campaigns
8.0,No,465143.0,505124.0,47.94%,No,Ref,"Increases motor fuel, ton-mile taxes"
10.0,No,402608.0,536502.0,42.87%,No,Init,Repeals land use planning coordination statutes
